{
  "schemaVersion": "2.0",
  "reportType": "executive",
  "skillName": "codepulse-exec",
  "application": "CodePulse",
  "repository": "C:/Users/tcaron/repos/CodePulse",
  "assessmentDate": "2026-10-01",
  "sourceReport": "codepulse-quality/reports/codepulse-quality_2026-10-01-result.json",
  "executive": {
    "dashboard": {
      "overallGrade": "B",
      "securityPosture": "Not Assessed",
      "technologyHealth": "Not Assessed",
      "maintainability": "Manageable",
      "operationalRisk": "Not Assessed",
      "modernizationReadiness": "Not Assessed"
    },
    "snapshot": [
      "CodePulse's own tooling is in good condition from a code-quality standpoint. The single executable component, its contract validator, is small, easy to read, and has no complexity hotspots.",
      "The main concern is repetition: each new framework rule is added by copying existing checks, which slowly raises the cost and error rate of change. This is a low-effort fix, not a structural problem."
    ],
    "topRisks": [
      {
        "risk": "Rising maintenance effort in the contract validator",
        "businessImpact": "Each new CodePulse rule takes longer to add and is more likely to be checked inconsistently, slowing framework evolution.",
        "priority": "Medium",
        "findingIds": ["QUAL-ACC-001", "QUAL-001"]
      },
      {
        "risk": "Manual upkeep when skills are added or removed",
        "businessImpact": "Expanding the skill catalog requires hand-editing validation rules, adding friction to product growth.",
        "priority": "Low",
        "findingIds": ["QUAL-ACC-002"]
      }
    ],
    "strengths": [
      "Readable, low-complexity validation logic",
      "Clear, specific failure messages that shorten troubleshooting",
      "Structured schema checks rather than fragile text matching"
    ],
    "investmentPriorities": [
      {
        "area": "Technical debt reduction in the validator",
        "whyItMatters": "Consolidating repeated checks keeps the framework cheap to extend as rules grow.",
        "businessBenefit": "Faster, more reliable delivery of new CodePulse capabilities.",
        "priority": "Medium"
      },
      {
        "area": "Contributor experience",
        "whyItMatters": "Reporting all validation failures at once removes repeated run-fix cycles.",
        "businessBenefit": "Shorter change cycles for framework contributors.",
        "priority": "Low"
      }
    ],
    "modernizationOutlook": {
      "complexity": "Low",
      "summary": "Within the assessed scope (code quality only), improvements are small, localized refactors with no architectural blockers.",
      "concerns": ["Security, dependency lifecycle, and exposure were outside the source assessment."],
      "nextSteps": ["Run codepulse-full to assess the remaining categories before making portfolio decisions."]
    },
    "recommendation": {
      "decision": "Continue Current Investment",
      "rationale": "Code quality is good and the identified debt is low-effort to resolve. A full assessment is needed before drawing conclusions on security or lifecycle risk."
    }
  },
  "limitations": [
    "Source result covers code quality only; Security Posture, Technology Health, Operational Risk, and Modernization Readiness are Not Assessed.",
    "The overall grade reflects the code-quality category only, not a weighted full assessment."
  ]
}
